videoid,contentUrl,duration,page_dir,name
1041976831,https://ak.picdn.net/shutterstock/videos/1041976831/preview/stock-footage-warm-christmas-fireplace-atmosphere-with-christmas-tree-during-snowfall-cozy-christmas-feeling.mp4,PT00H00M30S,123301_123350,Warm christmas fireplace atmosphere with christmas tree during snowfall. cozy christmas feeling.
1014161768,https://ak.picdn.net/shutterstock/videos/1014161768/preview/stock-footage-chef-adds-drops-of-olive-oil-to-spinach-puree-soup.mp4,PT00H00M09S,106751_106800,Chef adds drops of olive oil to spinach puree soup
25546736,https://ak.picdn.net/shutterstock/videos/25546736/preview/stock-footage--pile-of-plastic-garbage-on-sea-shore-of-industrial-portpiles-of-plastic-and-other-garbage-on-the.mp4,PT00H00M13S,038601_038650, pile of plastic garbage on sea shore of industrial portpiles of plastic and other garbage on the shore of a beach near the port of an industrial area.
1012214375,https://ak.picdn.net/shutterstock/videos/1012214375/preview/stock-footage-a-beautiful-landscape-taken-with-the-drone.mp4,PT00H00M15S,066651_066700,A beautiful landscape taken with the drone.
8709268,https://ak.picdn.net/shutterstock/videos/8709268/preview/stock-footage-hai-duong-vietnam-january-buying-and-selling-at-the-local-street-market-the-market-is.mp4,PT00H00M09S,117651_117700,"Hai duong, vietnam, january, 12: buying and selling at the local street market. the market is flooded with all kinds of local foods. "
1049494045,https://ak.picdn.net/shutterstock/videos/1049494045/preview/stock-footage-moscow-russia-february-amg-logo-at-dealer-showroom-mercedes-amg-gmbh-commonly-known-as.mp4,PT00H00M11S,176301_176350,"Moscow, russia - february, 2020: amg logo at dealer showroom. mercedes-amg gmbh, commonly known as amg, is the high-performance division of daimler ag"
24003868,https://ak.picdn.net/shutterstock/videos/24003868/preview/stock-footage-in-the-policlinic-young-man-looking-at-an-x-ray-image-of-a-spine-male-with-small-mustache-dressed.mp4,PT00H00M13S,176101_176150,"In the policlinic young man looking at an x-ray image of a spine. male with small mustache, dressed in a white plaid shirt, which is rolled up his sleeves, standing in a corridor spacious bright room"
1037537549,https://ak.picdn.net/shutterstock/videos/1037537549/preview/stock-footage-pretty-young-teen-girl-and-funny-pug-dog-playing-with-toy-play-fun-and-joy-with-owner-together.mp4,PT00H00M17S,033651_033700,"Pretty young teen girl and funny pug dog playing with toy. play, fun and joy with owner together."
1024438343,https://ak.picdn.net/shutterstock/videos/1024438343/preview/stock-footage-close-up-shot-of-little-girl-eating-at-home.mp4,PT00H00M15S,131551_131600,Close up shot of little girl eating at home.
1878781,https://ak.picdn.net/shutterstock/videos/1878781/preview/stock-footage--years-boy-behind-couch-acting-playfully.mp4,PT00H00M06S,007151_007200,5-6 years boy behind couch acting playfully
33179869,https://ak.picdn.net/shutterstock/videos/33179869/preview/stock-footage-plastic-surgeon-performs-an-operation-for-abdominoplasty-with-a-transfer-of-the-navel.mp4,PT00H00M15S,066151_066200,Plastic surgeon performs an operation for abdominoplasty with a transfer of the navel
1018811059,https://ak.picdn.net/shutterstock/videos/1018811059/preview/stock-footage-a-horse-eating-some-grass-on-autumn-day.mp4,PT00H00M40S,107051_107100,A horse eating some grass on autumn day
2003687,https://ak.picdn.net/shutterstock/videos/2003687/preview/stock-footage-lakes-with-waterfall-in-croatia-europe-location-plitvice-national-park-plitvicka-jezera.mp4,PT00H00M10S,094801_094850,"Lakes with waterfall in croatia, europe. location: plitvice, national park plitvicka jezera."
1051007839,https://ak.picdn.net/shutterstock/videos/1051007839/preview/stock-footage-bank-vault-doors-open-and-piles-of-dollars-are-poured-out-d-render.mp4,PT00H00M21S,142351_142400,Bank vault doors open and piles of dollars are poured out. 3d render
1045417,https://ak.picdn.net/shutterstock/videos/1045417/preview/stock-footage-portrait-of-a-smiling-male-surgeon-hd-photo-jpeg-dolly.mp4,PT00H00M14S,079801_079850,"Portrait of a smiling    male surgeon; hd photo jpeg, dolly."
26926873,https://ak.picdn.net/shutterstock/videos/26926873/preview/stock-footage-young-blonde-gymnast-woman-playing-with-ball-slow-motion.mp4,PT00H00M52S,002951_003000,Young blonde gymnast woman playing with ball slow motion
1020221668,https://ak.picdn.net/shutterstock/videos/1020221668/preview/stock-footage-the-cross-of-the-cardan-this-part-of-the-car-s-transmission.mp4,PT00H00M07S,171501_171550,The cross of the cardan. this part of the car's transmission.
1019880664,https://ak.picdn.net/shutterstock/videos/1019880664/preview/stock-footage-female-stylist-dyes-hair-of-male-man-in-barbershop-personal-care-and-beauty.mp4,PT00H00M31S,043751_043800,"Female stylist dyes hair of male man in barbershop, personal care and beauty"
3022696,https://ak.picdn.net/shutterstock/videos/3022696/preview/stock-footage-marine-dock-in-the-sea.mp4,PT00H00M10S,138801_138850,Marine dock in the sea
22713202,https://ak.picdn.net/shutterstock/videos/22713202/preview/stock-footage-people-walking-on-sunset-at-south-miami-beach.mp4,PT00H00M20S,012001_012050,People walking on sunset at south miami beach
10695257,https://ak.picdn.net/shutterstock/videos/10695257/preview/stock-footage-driveway-basketball-hoop-with-spiderwebs-on-net-k.mp4,PT00H00M22S,085301_085350,Driveway basketball hoop with spiderwebs on net 4k
13625594,https://ak.picdn.net/shutterstock/videos/13625594/preview/stock-footage-grilled-chicken-wings.mp4,PT00H00M37S,048801_048850,Grilled chicken wings.
1014869206,https://ak.picdn.net/shutterstock/videos/1014869206/preview/stock-footage-waving-australian-flag-on-top-of-a-building.mp4,PT00H00M11S,183051_183100,Waving australian flag on top of a building
1031896082,https://ak.picdn.net/shutterstock/videos/1031896082/preview/stock-footage-waist-up-shot-of-beautiful-senior-lady-with-silver-hair-wearing-beige-jumper-sitting-with-her.mp4,PT00H00M23S,187051_187100,"Waist-up shot of beautiful senior lady with silver hair, wearing beige jumper, sitting with her companion at breakfast in restaurant engaged in animated conversation, expressing surprise and amazement"
1011516977,https://ak.picdn.net/shutterstock/videos/1011516977/preview/stock-footage-aerial-photography-of-china-s-western-sichuan-plateau.mp4,PT00H01M24S,149151_149200,Aerial photography of china's western sichuan plateau
33896686,https://ak.picdn.net/shutterstock/videos/33896686/preview/stock-footage-underwater-relax-video-about-coral-reef-of-red-sea-bright-marine-nature-on-background-of-beautiful.mp4,PT00H00M14S,142601_142650,Underwater relax video about coral reef of red sea. bright marine nature on background of beautiful lagoon.
424783,https://ak.picdn.net/shutterstock/videos/424783/preview/stock-footage-glamour-kitty-var-kitty-eats-redden-roe.mp4,PT00H00M20S,195001_195050,Glamour kitty (var. 2) kitty eats redden roe 
1033004249,https://ak.picdn.net/shutterstock/videos/1033004249/preview/stock-footage-mystic-and-foggy-drone-flight-over-the-rainforest-in-mountain-middle-view-move-to-backwards.mp4,PT00H00M46S,074801_074850,Mystic and foggy drone flight over the rainforest in mountain. middle view. move to backwards
3698024,https://ak.picdn.net/shutterstock/videos/3698024/preview/stock-footage-little-girl-smiling-on-a-swing-in-summer-park.mp4,PT00H00M30S,182901_182950,Little girl smiling on a swing in summer park
1015243150,https://ak.picdn.net/shutterstock/videos/1015243150/preview/stock-footage-los-angeles-united-states-september-aerial-view-of-skyscrapers-and-towers-in-los-angeles.mp4,PT00H00M20S,011101_011150,"Los angeles, united states - september, 2017: aerial view of skyscrapers and towers in los angeles"
1022868589,https://ak.picdn.net/shutterstock/videos/1022868589/preview/stock-footage-the-girl-in-the-kitchen-inserts-a-wooden-stick-into-the-just-assembled-sandwich-a-white-bread.mp4,PT00H00M08S,114801_114850,The girl in the kitchen inserts a wooden stick into the just-assembled sandwich. a white bread sandwich with fresh green leaf lettuce lies on a wooden stand.
33577882,https://ak.picdn.net/shutterstock/videos/33577882/preview/stock-footage-beautiful-women-toasting-at-a-christmas-holiday-party-floating-handheld-trucking.mp4,PT00H00M11S,091951_092000,"Beautiful women toasting at a christmas/holiday party, floating handheld trucking"
1015846780,https://ak.picdn.net/shutterstock/videos/1015846780/preview/stock-footage-timelapse-across-london-from-a-bus-hyper-lapse.mp4,PT00H00M21S,005201_005250,Timelapse across london from a bus (hyper lapse)
17190832,https://ak.picdn.net/shutterstock/videos/17190832/preview/stock-footage-smiling-asian-businessman.mp4,PT00H00M12S,058951_059000,Smiling asian businessman
1011167633,https://ak.picdn.net/shutterstock/videos/1011167633/preview/stock-footage-abstract-flying-flickering-particles-turn-into-a-hand-sign-animation-of-seamless-loop.mp4,PT00H00M23S,113951_114000,Abstract flying flickering particles turn into a hand sign. animation of seamless loop.
22771174,https://ak.picdn.net/shutterstock/videos/22771174/preview/stock-footage-dolly-of-ornaments-on-a-christmas-tree.mp4,PT00H00M11S,142401_142450,Dolly of ornaments on a christmas tree
1052831360,https://ak.picdn.net/shutterstock/videos/1052831360/preview/stock-footage-belgrad-serbia-may-view-from-air-on-belgrade-center-near-branko-s-brigde-serbia-drone.mp4,PT00H00M19S,194151_194200,"Belgrad/serbia - may 16 2020: view from air on belgrade center near branko's brigde, serbia. drone view of belgrade at night. "
1041728269,https://ak.picdn.net/shutterstock/videos/1041728269/preview/stock-footage-rising-aerial-drone-above-historic-battlefield-cannons-reenactment.mp4,PT00H00M23S,111301_111350,"Rising aerial drone above historic battlefield & cannons, reenactment"
1018885528,https://ak.picdn.net/shutterstock/videos/1018885528/preview/stock-footage-cooked-on-grilled-pork-with-fresh-herbs.mp4,PT00H00M43S,188001_188050,Cooked on grilled pork with fresh herbs
29434411,https://ak.picdn.net/shutterstock/videos/29434411/preview/stock-footage-new-york-september-time-lapse-river-un-building.mp4,PT00H00M46S,026651_026700,"New york, september 2015, time lapse river , un building"
1029360176,https://ak.picdn.net/shutterstock/videos/1029360176/preview/stock-footage-slow-motion-view-of-water-and-waves-of-sea-from-sailing-yacht.mp4,PT00H00M35S,174951_175000,Slow motion view of water and waves of sea from sailing yacht
1032346205,https://ak.picdn.net/shutterstock/videos/1032346205/preview/stock-footage-red-paper-lantern-floating-on-the-river-at-night-with-hoi-an-town-reflections-in-the-background-in.mp4,PT00H00M13S,012901_012950,Red paper lantern floating on the river at night with hoi an town reflections in the background in vietnam
1011294770,https://ak.picdn.net/shutterstock/videos/1011294770/preview/stock-footage-tri-colors-of-siamese-fighting-fish.mp4,PT00H00M14S,111251_111300,Tri colors of siamese fighting fish 
23282965,https://ak.picdn.net/shutterstock/videos/23282965/preview/stock-footage-jan-russia-moscow-vietnamese-cafe-in-the-danilovsky-market-chefs-from-vietnam-prepare.mp4,PT00H00M11S,135851_135900,"Jan 21. 2017 russia, moscow: vietnamese cafe in the danilovsky market. chefs from vietnam prepare national dishes. time lapse."
23142370,https://ak.picdn.net/shutterstock/videos/23142370/preview/stock-footage-coquitlam-bc-canada-january-one-side-of-selling-chinese-new-year-scroll-display-and.mp4,PT00H00M11S,059001_059050,"Coquitlam, bc, canada - january 14, 2017 : one side of selling chinese new year scroll display and shopper walking through inside walmart store"
27423238,https://ak.picdn.net/shutterstock/videos/27423238/preview/stock-footage-abstract-technologic-background-with-stripes-and-particles-animation-of-circuit-electric-signal.mp4,PT00H00M20S,031051_031100,Abstract technologic background with stripes and particles. animation of circuit electric signal with light shine. animation of seamless loop.
15641101,https://ak.picdn.net/shutterstock/videos/15641101/preview/stock-footage-melting-butter-into-the-hot-pan-slow-motion-k-shot.mp4,PT00H00M25S,056351_056400,Melting butter into the hot pan. slow motion 4k shot
1016048242,https://ak.picdn.net/shutterstock/videos/1016048242/preview/stock-footage-cook-stirs-a-large-pot-of-food.mp4,PT00H00M22S,126251_126300,Cook stirs a large pot of food
4554272,https://ak.picdn.net/shutterstock/videos/4554272/preview/stock-footage-playing-croquet.mp4,PT00H00M10S,135101_135150,Playing croquet
28996405,https://ak.picdn.net/shutterstock/videos/28996405/preview/stock-footage-unrecognizable-people-blurred-video-pupils-boys-and-girls-come-in-the-school-s-auditorium.mp4,PT00H00M15S,088501_088550,"Unrecognizable people, blurred video. pupils boys and girls come in the school's auditorium designed in a sea style for presentation"
1062150454,https://ak.picdn.net/shutterstock/videos/1062150454/preview/stock-footage-poison-animated-icon-k-animated-icon-to-improve-project-and-explainer-video.mp4,PT00H00M09S,130101_130150,Poison animated icon. 4k animated icon to improve project and explainer video
1012468937,https://ak.picdn.net/shutterstock/videos/1012468937/preview/stock-footage-soccer-ball-with-south-korea-flag-colors-rotates-on-transparent-background-d-rendering-prores.mp4,PT00H00M10S,048101_048150,"Soccer ball with south korea flag colors rotates on transparent background, 3d rendering, prores 4444 with alpha channel, loop"
1020368503,https://ak.picdn.net/shutterstock/videos/1020368503/preview/stock-footage-snowflakes-fall-from-the-snow-covered-branches-of-the-tree.mp4,PT00H00M22S,134651_134700,Snowflakes fall from the snow-covered branches of the tree.
1031788229,https://ak.picdn.net/shutterstock/videos/1031788229/preview/stock-footage-businessman-holding-a-briefcase-isolated-in-the-middle-of-the-ocean-against-beautiful-sunrise.mp4,PT00H00M25S,180701_180750,"Businessman holding a briefcase, isolated in the middle of the ocean, against beautiful sunrise"
17922145,https://ak.picdn.net/shutterstock/videos/17922145/preview/stock-footage-russia-moscow-june-exhibits-at-the-exhibition-rosupack-at-crocus-expo-the-only.mp4,PT00H00M17S,066101_066150,"Russia, moscow - june 14, 2016: exhibits at the exhibition ""rosupack"" at crocus expo. the only exhibition in russia is represented by the packaging production process. exhibition held in moscow"
1035685622,https://ak.picdn.net/shutterstock/videos/1035685622/preview/stock-footage-bird-eye-view-of-lake-surface-in-blue-moving-from-sky-view.mp4,PT00H00M15S,048651_048700,"Bird eye view of lake surface in blue, moving from sky view"
1048898221,https://ak.picdn.net/shutterstock/videos/1048898221/preview/stock-footage-green-barley-field-cereals-nature.mp4,PT00H00M10S,068451_068500,"Green barley field, cereals, nature"
1013757989,https://ak.picdn.net/shutterstock/videos/1013757989/preview/stock-footage-a-stars-sign.mp4,PT00H00M20S,065901_065950,A stars sign
30106516,https://ak.picdn.net/shutterstock/videos/30106516/preview/stock-footage-anomaly-animated-word-cloud-text-design-animation.mp4,PT00H00M15S,053751_053800,"Anomaly animated word cloud, text design animation."
1049682214,https://ak.picdn.net/shutterstock/videos/1049682214/preview/stock-footage-farmers-working-in-the-hass-avocado-harvest-season-unfocused.mp4,PT00H00M08S,180901_180950,Farmers working in the hass avocado harvest season. unfocused
3619895,https://ak.picdn.net/shutterstock/videos/3619895/preview/stock-footage-fresh-grilled-beef-meat-fillet-on-white-plate-with-tomatoes-and-red-pepper-over-blue-wood-table.mp4,PT00H00M15S,016801_016850,Fresh grilled beef meat fillet on white plate with tomatoes and red pepper over blue wood table
1024318304,https://ak.picdn.net/shutterstock/videos/1024318304/preview/stock-footage-fluid-art-abstract-colorful-background-mixing-paints-modern-art.mp4,PT00H00M21S,042551_042600,"Fluid art. abstract colorful background, mixing paints. modern art."
28825816,https://ak.picdn.net/shutterstock/videos/28825816/preview/stock-footage-orthodox-hasidic-jew-praying-with-a-tallit-at-wailing-wall-in-jerusalem-the-western-wall-of.mp4,PT00H00M26S,192451_192500,Orthodox hasidic jew praying with a tallit at wailing wall in jerusalem ( the western wall of jerusalem. )
1023692680,https://ak.picdn.net/shutterstock/videos/1023692680/preview/stock-footage-software-engineer-checking-connections-of-cryptocurrency-rig-and-tracking-progress-of-bitcoin.mp4,PT00H00M14S,199301_199350,Software engineer checking connections of cryptocurrency rig and tracking progress of bitcoin mining using smartphone
1023440545,https://ak.picdn.net/shutterstock/videos/1023440545/preview/stock-footage-kalamata-greece-feb-crowds-of-people-in-kalamata-celebrates-candlemas-feast-of-the.mp4,PT00H00M11S,110951_111000,"Kalamata, greece feb 2 2019: crowds of people in kalamata celebrates candlemas (feast of the presentation of our lord jesus) a christian holy day commemorating the presentation of jesus at the temple"
1042556020,https://ak.picdn.net/shutterstock/videos/1042556020/preview/stock-footage-warsaw-poland-december-bright-red-chinese-toys-lanterns-with-hieroglyphs-and-symbols.mp4,PT00H00M05S,145801_145850,"Warsaw, poland - december 5, 2019: bright red chinese toys, lanterns with hieroglyphs and symbols, dark background"
1017149257,https://ak.picdn.net/shutterstock/videos/1017149257/preview/stock-footage-caribbean-women-hands-drumming-on-traditional-drums-drum-on-the-beach-le-diamant-martinique.mp4,PT00H00M11S,041501_041550,Caribbean women hands drumming on traditional drums / drum on the beach - le diamant - martinique
1012797986,https://ak.picdn.net/shutterstock/videos/1012797986/preview/stock-footage-building-construction-fast-time-lapse-summer-view-day-blue-sky-white-cloud-green-tree-stock-footage.mp4,PT00H00M10S,050201_050250,Building construction fast time lapse summer view day blue sky white cloud green tree stock footage
25937228,https://ak.picdn.net/shutterstock/videos/25937228/preview/stock-footage-audience-meeting-people-sitting-and-listen-to-the-conference-or-presentation-workshop-master.mp4,PT00H00M11S,179101_179150,"Audience meeting - people sitting and listen to the conference or presentation, workshop, master class"
1022317027,https://ak.picdn.net/shutterstock/videos/1022317027/preview/stock-footage-beautiful-young-funny-man-dancing-on-orange-background-and-have-fun-on-holidays.mp4,PT00H00M08S,171001_171050,"Beautiful young funny man dancing on orange background and have fun on holidays
"
20536318,https://ak.picdn.net/shutterstock/videos/20536318/preview/stock-footage-little-girl-hugging-her-grandmother-on-christmas.mp4,PT00H00M11S,052801_052850,Little girl hugging her grandmother on christmas
22941415,https://ak.picdn.net/shutterstock/videos/22941415/preview/stock-footage-eggs-and-sausage-in-a-pan-salt.mp4,PT00H00M16S,141801_141850,Eggs and sausage in a pan salt
21055003,https://ak.picdn.net/shutterstock/videos/21055003/preview/stock-footage-zug-switzerland-august-beautiful-swiss-landscape-from-boat-with-houses-and-swiss-alps.mp4,PT00H00M22S,141401_141450,"Zug, switzerland - august 27, 2016 - beautiful swiss landscape from boat with houses and swiss alps, switzerland, europe. 
"
4090111,https://ak.picdn.net/shutterstock/videos/4090111/preview/stock-footage-sweet-bread-french-bread-over-blue-wooden-table-x-intro-motion-slow-hidef-hd.mp4,PT00H00M15S,076951_077000,Sweet bread : french bread over blue wooden table 1920x1080 intro motion slow hidef hd
1023362290,https://ak.picdn.net/shutterstock/videos/1023362290/preview/stock-footage-beautiful-slim-brunette-girl-involved-in-sports-and-gymnastics-on-a-purple-rug.mp4,PT00H00M11S,035351_035400,Beautiful slim brunette girl involved in sports and gymnastics on a purple rug
1059994826,https://ak.picdn.net/shutterstock/videos/1059994826/preview/stock-footage-animation-of-social-networking-icons-and-rising-count-of-numbers-over-sitting-at-a-table-in-a.mp4,PT00H00M10S,098901_098950,Animation of social networking icons and rising count of numbers over sitting at a table in a restaurant using smartphone. global digital network digitally generated image.
1037425406,https://ak.picdn.net/shutterstock/videos/1037425406/preview/stock-footage-interracial-couple-walking-along-street-with-map.mp4,PT00H00M42S,064951_065000,Interracial couple walking along street with map
1010732606,https://ak.picdn.net/shutterstock/videos/1010732606/preview/stock-footage--k-footage-of-female-dentist-examines-girl-s-oral-cavity-in-dental-clinic.mp4,PT00H00M19S,190601_190650,4k footage of female dentist examines girl's oral cavity in dental clinic
6784786,https://ak.picdn.net/shutterstock/videos/6784786/preview/stock-footage-many-pigeons-on-the-ground-inside-the-city-biker-and-people-walking-near-them.mp4,PT00H00M26S,115351_115400,"Many pigeons on the ground, inside the city, biker and people walking near them"
20867620,https://ak.picdn.net/shutterstock/videos/20867620/preview/stock-footage-futuristic-rotating-blue-dna-strand-genetic-engineering-scientific-background-simple-loop-d.mp4,PT00H00M40S,110201_110250,Futuristic rotating  blue dna strand. genetic engineering scientific background. simple loop 3d animation. template for biochemistry and biology projects.
3095734,https://ak.picdn.net/shutterstock/videos/3095734/preview/stock-footage-sequence-making-dough-into-french-croissants.mp4,PT00H00M19S,027701_027750,Sequence making dough into french croissants
23067238,https://ak.picdn.net/shutterstock/videos/23067238/preview/stock-footage-winter-it-is-snowing-view-of-the-cathedral-square-in-poltava-in-ukraine-on-the-square-are-the.mp4,PT00H00M23S,088351_088400,Winter. it is snowing. view of the cathedral square in poltava in ukraine. on the square are the cathedral with a bell tower.
11279873,https://ak.picdn.net/shutterstock/videos/11279873/preview/stock-footage-guinea-fowl-bird-mating-call-kenya-wildlife-safari-lake-nakuru.mp4,PT00H00M19S,071801_071850,"Guinea fowl bird mating call, kenya wildlife safari lake nakuru"
1020322903,https://ak.picdn.net/shutterstock/videos/1020322903/preview/stock-footage-soft-snowfall-in-the-winter-snowy-forest-evening-winter-landscape-spruce-branch-in-the-snow.mp4,PT00H00M30S,091201_091250,"Soft snowfall in the winter snowy forest, evening winter landscape, spruce branch in the snow"
1041519088,https://ak.picdn.net/shutterstock/videos/1041519088/preview/stock-footage-hands-combed-baby-girl-s-hair-with-a-fine-comb.mp4,PT00H00M11S,184801_184850,Hands combed baby girl's hair with a fine comb
1016999593,https://ak.picdn.net/shutterstock/videos/1016999593/preview/stock-footage-dolly-shot-of-black-man-wearing-windbreaker-running-in-forest-on-chilly-morning.mp4,PT00H00M13S,176801_176850,Dolly shot of black man wearing windbreaker running in forest on chilly morning
34229287,https://ak.picdn.net/shutterstock/videos/34229287/preview/stock-footage-a-lot-of-people-skate-on-ice-rink-only-legs-are-visible-men-women-children-couples-commercial.mp4,PT00H00M19S,031401_031450,"A lot of people skate on ice rink, only legs are visible. men, women, children, couples. commercial"
23830594,https://ak.picdn.net/shutterstock/videos/23830594/preview/stock-footage-sheet-of-postcards-with-national-flag-of-usa-sate-symbol-of-united-states-nation-and-government.mp4,PT00H00M11S,126301_126350,Sheet of postcards with national flag of usa. sate symbol of united states nation and government.
1041265420,https://ak.picdn.net/shutterstock/videos/1041265420/preview/stock-footage--k-closeup-footage-of-camera-slowly-moving-between-fresh-green-lettuce-of-cabbage-leaves-concept.mp4,PT00H00M18S,091901_091950,4k closeup footage of camera slowly moving between fresh green lettuce of cabbage leaves. concept of healthy nutrition and organic food. perfect background for vegetarian or vegan
16997683,https://ak.picdn.net/shutterstock/videos/16997683/preview/stock-footage-slow-motion-shot-of-young-woman-lighting-sparklers-in-garden.mp4,PT00H00M23S,064651_064700,"Slow motion shot of young woman lighting sparklers in garden
"
15362548,https://ak.picdn.net/shutterstock/videos/15362548/preview/stock-footage-medical-doctor-making-ultrasound-with-modern-equipment.mp4,PT00H00M14S,046301_046350,Medical doctor making ultrasound with modern equipment
1028485739,https://ak.picdn.net/shutterstock/videos/1028485739/preview/stock-footage-the-concept-of-musical-background-love-for-music.mp4,PT00H00M22S,039751_039800,The concept of musical background. love for music. 17
1029074921,https://ak.picdn.net/shutterstock/videos/1029074921/preview/stock-footage-clapperboard-word-cloud-animated-isolated-on-white.mp4,PT00H00M10S,199051_199100,Clapperboard word cloud animated isolated on white
6804946,https://ak.picdn.net/shutterstock/videos/6804946/preview/stock-footage-zebras-grazing-grass-on-safari.mp4,PT00H00M06S,023951_024000,"Zebras grazing grass on safari
"
13812581,https://ak.picdn.net/shutterstock/videos/13812581/preview/stock-footage-the-man-cleans-snow-on-the-red-car-that-lies-on-the-windscreen-he-used-special-brush-action-in.mp4,PT00H00M13S,135451_135500,The man cleans snow on the red car that lies on the windscreen. he used special brush. action in the winter. 
1048983286,https://ak.picdn.net/shutterstock/videos/1048983286/preview/stock-footage-marrakesh-morocco-june-close-up-pan-of-the-jemaa-el-fnaa-bazaar-in-marrakesh-morroco.mp4,PT00H00M15S,183951_184000,"Marrakesh, morocco- june, 10, 2019: close up pan of the jemaa el-fnaa bazaar in marrakesh, morroco"
25895570,https://ak.picdn.net/shutterstock/videos/25895570/preview/stock-footage-aerial-view-of-beach-at-lombok-indonesia.mp4,PT00H00M13S,107751_107800,"Aerial view of beach at lombok, indonesia."
