videoid,contentUrl,duration,page_dir,name
1028296808,https://ak.picdn.net/shutterstock/videos/1028296808/preview/stock-footage-stratford-upon-avon-warwickshire-uk-april-view-from-a-canal-bridge-in-stratford-upon.mp4,PT00H00M16S,057301_057350,"Stratford upon avon, warwickshire, uk - april 19, 2019: view from a canal bridge in stratford upon avon with royal shakespeare theatre and big wheel on a busy warm spring day"
1060953163,https://ak.picdn.net/shutterstock/videos/1060953163/preview/stock-footage-beautiful-picturesque-rock-of-the-adriatic-sea-in-montenegro-seashore-on-a-summer-day.mp4,PT00H00M06S,058251_058300,Beautiful picturesque rock of the adriatic sea in montenegro. seashore on a summer day.
1012270628,https://ak.picdn.net/shutterstock/videos/1012270628/preview/stock-footage-portrait-of-little-girl-jumping-and-dancing.mp4,PT00H00M11S,050301_050350,Portrait of little girl jumping and dancing.
15068392,https://ak.picdn.net/shutterstock/videos/15068392/preview/stock-footage-detox-citrus-infused-water-as-a-refreshing-summer-drink.mp4,PT00H00M09S,022951_023000,Detox citrus infused water as a refreshing summer drink.
33467464,https://ak.picdn.net/shutterstock/videos/33467464/preview/stock-footage-abstract-blur-image-of-people-go-to-shopping-in-night-market-festival-for-background-usage-vintage.mp4,PT00H00M13S,139351_139400,"Abstract blur image of people go to shopping in night market festival for background usage, vintage tone, top view or bird eye view composition."
1009660361,https://ak.picdn.net/shutterstock/videos/1009660361/preview/stock-footage-slow-process-of-pouring-yellow-orange-in-transparent-glass-on-white-background.mp4,PT00H00M17S,011951_012000,Slow process of pouring yellow orange in transparent glass on white background.
1028593952,https://ak.picdn.net/shutterstock/videos/1028593952/preview/stock-footage-kid-opens-the-door-to-room-and-runs-into-it-small-child-opens-white-door-to-room-by-reaching-door.mp4,PT00H00M12S,039451_039500,Kid opens the door to room and runs into it. small child opens white door to room by reaching door handle close-up
10861841,https://ak.picdn.net/shutterstock/videos/10861841/preview/stock-footage-solar-panels-in-bayern-germany-solar-power-in-germany-accounted-for-an-estimated-to.mp4,PT00H00M10S,077151_077200,"Solar panels in bayern, germany. solar power in germany accounted for an estimated 6.2 to 6.9 percent of the country's net-electricity generation in 2014."
8893840,https://ak.picdn.net/shutterstock/videos/8893840/preview/stock-footage-sunset-in-the-winter-forest-k-time-lapse.mp4,PT00H00M06S,197651_197700,"Sunset in the winter forest, 4k time-lapse"
8192689,https://ak.picdn.net/shutterstock/videos/8192689/preview/stock-footage-view-from-piran-to-italian-and-slovenian-alps-adriatic-sea-cargo-ship-floating-to-trieste-or.mp4,PT00H00M14S,177701_177750,"View from piran to italian and slovenian alps, adriatic sea. cargo ship floating to trieste or koper harbor.
"
1010542940,https://ak.picdn.net/shutterstock/videos/1010542940/preview/stock-footage-smiling-bright-woman-signing-up-the-documents-focused-young-man-typing-on-black-laptop-in-the.mp4,PT00H00M09S,053951_054000,"Smiling bright woman signing up the documents, focused young man typing on black laptop in the background, managers working in the office during the week"
17469175,https://ak.picdn.net/shutterstock/videos/17469175/preview/stock-footage-asian-woman-playing-with-her-tabby-cat-slow-motion.mp4,PT00H00M24S,186501_186550,"Asian woman playing with her tabby cat,slow motion
"
1049705935,https://ak.picdn.net/shutterstock/videos/1049705935/preview/stock-footage-home-schooling-mother-and-son-doing-art-supplies-homework.mp4,PT00H00M14S,141351_141400,Home schooling. mother and son doing art supplies homework
19015300,https://ak.picdn.net/shutterstock/videos/19015300/preview/stock-footage-charming-young-woman-watching-green-screened-television-tablet-charming-young-woman-watching-green.mp4,PT00H00M14S,105301_105350,Charming young woman watching green screened television tablet. charming young woman watching green screened television and tablet at home. ungraded 4k
1065246469,https://ak.picdn.net/shutterstock/videos/1065246469/preview/stock-footage-rounded-bomb-animated-cartoon-vector-orange-background.mp4,PT00H00M06S,112751_112800,Rounded bomb animated cartoon vector orange background
21838003,https://ak.picdn.net/shutterstock/videos/21838003/preview/stock-footage-amazing-fantastic-colorful-fountain-with-bright-illumination-on-the-water-pond-or-river-with.mp4,PT00H00M18S,106751_106800,Amazing fantastic colorful fountain with bright illumination on the water pond or river with beautiful reflection at the evening or night. beauty urban recreational concept.
1031960687,https://ak.picdn.net/shutterstock/videos/1031960687/preview/stock-footage-aerial-descend-pan-up-blue-ocean-surrounding-rocks-and-small-shore-esperance-australia.mp4,PT00H00M42S,112201_112250,"Aerial descend/pan up: blue ocean surrounding rocks and small shore - esperance, australia"
1031791748,https://ak.picdn.net/shutterstock/videos/1031791748/preview/stock-footage-abstract-background-with-beautiful-color-k.mp4,PT00H00M07S,038201_038250,Abstract background with beautiful color 4k
1030828316,https://ak.picdn.net/shutterstock/videos/1030828316/preview/stock-footage-employees-of-marketing-department-on-the-meeting.mp4,PT00H00M18S,001351_001400,Employees of marketing department on the meeting
30229891,https://ak.picdn.net/shutterstock/videos/30229891/preview/stock-footage-lush-green-pasture-with-large-herd-of-cows-aerial-footage.mp4,PT00H00M16S,134851_134900,Lush green pasture with large herd of cows - aerial footage
7050520,https://ak.picdn.net/shutterstock/videos/7050520/preview/stock-footage-group-of-atlantic-puffins-in-the-united-kingdom.mp4,PT00H00M17S,184851_184900,Group of atlantic puffins in the united kingdom
1018578967,https://ak.picdn.net/shutterstock/videos/1018578967/preview/stock-footage-rhine-canyon-switzerland-k-footage.mp4,PT00H00M30S,129201_129250,Rhine canyon switzerland. 4k footage
1044765115,https://ak.picdn.net/shutterstock/videos/1044765115/preview/stock-footage-woman-scientist-pouring-chemicals-in-test-tube-at-lab.mp4,PT00H00M16S,191101_191150,Woman scientist pouring chemicals in test tube at lab
1010104949,https://ak.picdn.net/shutterstock/videos/1010104949/preview/stock-footage-bicycle-brakes-pads-actioning-on-running-wheel.mp4,PT00H00M09S,009351_009400,Bicycle brakes pads actioning on running wheel.
1019132095,https://ak.picdn.net/shutterstock/videos/1019132095/preview/stock-footage-hand-reveals-hologram-word-leverager.mp4,PT00H00M10S,061151_061200,Hand reveals hologram word-leverager
3891626,https://ak.picdn.net/shutterstock/videos/3891626/preview/stock-footage-railroad.mp4,PT00H01M00S,046951_047000,Railroad
1034824022,https://ak.picdn.net/shutterstock/videos/1034824022/preview/stock-footage-araucaria-bidwillii-spiked-branch-close-up-beautiful-view-of-araucaria-bidwillii-in-natural.mp4,PT00H00M08S,111301_111350,"Araucaria bidwillii spiked branch, close-up. beautiful view of araucaria bidwillii in natural habitat in sunny day, summer."
6293849,https://ak.picdn.net/shutterstock/videos/6293849/preview/stock-footage--k-closeup-of-pumping-donkey-equipement-and-parts-in-motion-closeup-of-linewire-and-counterweight.mp4,PT00H00M28S,021001_021050,4k closeup of pumping donkey equipement and parts in motion. closeup of linewire and counterweight and beams of a pumpjack with sunset light. shot in 4k uhd 3840 x 2160 at 60fps by the 4k guy
14077355,https://ak.picdn.net/shutterstock/videos/14077355/preview/stock-footage-effervescent-mix-of-oil-water-and-colorful-ink-moving-bubbles.mp4,PT00H00M33S,178951_179000,"Effervescent mix of oil, water and colorful ink. moving bubbles "
1051609321,https://ak.picdn.net/shutterstock/videos/1051609321/preview/stock-footage-man-in-black-mantle-draws-on-wall-with-spray-paint-in-background-of-sunlight-in-abandoned-building.mp4,PT00H00M26S,051851_051900,Man in black mantle draws on wall with spray paint in background of sunlight in abandoned building.
1055012606,https://ak.picdn.net/shutterstock/videos/1055012606/preview/stock-footage-cheetah-lying-on-the-ground-licking-its-mouth-and-looking-around-in-south-africa-static-shot.mp4,PT00H00M09S,051901_051950,Cheetah lying on the ground licking its mouth and looking around in south africa. -static shot
1055285339,https://ak.picdn.net/shutterstock/videos/1055285339/preview/stock-footage-panning-shot-of-man-s-hands-using-wireless-laptop-keyboard-at-work-with-overlayed-glitch-effect.mp4,PT00H00M17S,107101_107150,Panning shot of man's hands using wireless laptop keyboard at work with overlayed glitch effect
27207394,https://ak.picdn.net/shutterstock/videos/27207394/preview/stock-footage-yellow-barley-in-swaying.mp4,PT00H00M27S,013701_013750,Yellow barley in swaying
1030771802,https://ak.picdn.net/shutterstock/videos/1030771802/preview/stock-footage--k-casual-business-entrepreneur-working-on-laptop-at-home-talking-on-phone.mp4,PT00H00M13S,191151_191200,4k casual business entrepreneur working on laptop at home & talking on phone
18610376,https://ak.picdn.net/shutterstock/videos/18610376/preview/stock-footage-frankfurt-am-main-germany-september-klm-cityhopper-fokker-approaching-before-landing.mp4,PT00H00M29S,029601_029650,"Frankfurt am main, germany - september 6, 2015: klm cityhopper fokker 70 approaching before landing, slow motion. unofficial spotting on sep. 6, 2015"
1018972708,https://ak.picdn.net/shutterstock/videos/1018972708/preview/stock-footage-side-view-close-up-of-young-caucasian-male-chef-smelling-tray-of-cookies-in-kitchen.mp4,PT00H00M09S,074851_074900,Side view close up of young caucasian male chef smelling tray of cookies in kitchen 
1037995898,https://ak.picdn.net/shutterstock/videos/1037995898/preview/stock-footage-aerial-view-of-faroe-islands-a-territory-of-denmark-in-the-atlantic-ocean.mp4,PT00H00M07S,146351_146400,"Aerial view of faroe islands, a territory of denmark in the atlantic ocean."
30225886,https://ak.picdn.net/shutterstock/videos/30225886/preview/stock-footage-a-small-pile-of-american-paper-dollars-and-pill-medications.mp4,PT00H00M08S,082051_082100,A small pile of american paper dollars and pill medications
1017941761,https://ak.picdn.net/shutterstock/videos/1017941761/preview/stock-footage-blueprints-rolls-of-architectural-drawings-smoothly-rotate-on-the-surface-of-the-architectural.mp4,PT00H00M19S,078701_078750,Blueprints - rolls of architectural drawings smoothly rotate on the surface of the architectural plan of a modern house / seamless looping
1007754055,https://ak.picdn.net/shutterstock/videos/1007754055/preview/stock-footage-eyelash-extension-procedure-woman-eye-with-long-eyelashes.mp4,PT00H00M46S,197401_197450,Eyelash extension procedure. woman eye with long eyelashes.
12994862,https://ak.picdn.net/shutterstock/videos/12994862/preview/stock-footage-the-big-white-house-manor-in-alatskivi-estonia-alatskivi-manor-combines-three-completely-different.mp4,PT00H00M12S,060201_060250,The big white house manor in alatskivi estonia. alatskivi manor combines three completely different cultures: the scottish culture represented in the architecture of the manor house
15636091,https://ak.picdn.net/shutterstock/videos/15636091/preview/stock-footage-kherson-ukraine-mar-open-concert-and-shopping-day-festival-hands-holding-shooting.mp4,PT00H00M11S,074751_074800,"Kherson, ukraine - mar 25, 2016: open concert and shopping day festival - hands holding shooting video via smartphone of a festival event"
1032582914,https://ak.picdn.net/shutterstock/videos/1032582914/preview/stock-footage-street-brussels-avenue-parc-royal.mp4,PT00H00M20S,073151_073200,Street brussels avenue parc royal
29002561,https://ak.picdn.net/shutterstock/videos/29002561/preview/stock-footage-drone-rotates-above-multilevel-pagoda-in-traditional-buddhist-temple-complex-among-green-plants-in.mp4,PT00H00M13S,003001_003050,Drone rotates above multilevel pagoda in traditional buddhist temple complex among green plants in vietnam
32571094,https://ak.picdn.net/shutterstock/videos/32571094/preview/stock-footage-star-explosion-fast-moving-white-red-and-black-lights-animation-motion-background-seamless-loop.mp4,PT00H00M07S,062301_062350,"Star explosion. fast moving white, red and black lights. animation motion background. seamless loop. computer generated."
16650445,https://ak.picdn.net/shutterstock/videos/16650445/preview/stock-footage-asian-engineer-standing-in-front-of-semi-submersible-oil-rig-in-invergordon-scotland.mp4,PT00H00M15S,039801_039850,"Asian engineer standing in front of semi submersible oil rig in invergordon scotland
"
1059666833,https://ak.picdn.net/shutterstock/videos/1059666833/preview/stock-footage-cute-doodle-of-a-bird-girl-coming-together-in-pieces-first-the-wings-appear-spinning-then-body-arms.mp4,PT00H00M10S,046201_046250,Cute doodle of a bird girl coming together in pieces first the wings appear spinning then body arms and head also pop up flipping and finally round eyes with long eyelashes and a smile
8763961,https://ak.picdn.net/shutterstock/videos/8763961/preview/stock-footage-aerial-from-the-harbor-from-lagos-in-the-algarve-portugal.mp4,PT00H00M30S,127451_127500,Aerial from the harbor from lagos in the algarve portugal
1019883640,https://ak.picdn.net/shutterstock/videos/1019883640/preview/stock-footage-aerial-view-flight-over-porto-cristo-novo-cala-mendia-coast-with-villas-and-natural-harbor.mp4,PT00H00M23S,007701_007750,"Aerial view, flight over porto cristo novo, cala mendia coast with villas and natural harbor, mallorca, balearic islands, spain"
1055526344,https://ak.picdn.net/shutterstock/videos/1055526344/preview/stock-footage-a-pile-of-boiled-pasta-fusilli-rotates-slowly-on-table-on-a-black-background.mp4,PT00H00M18S,176551_176600,A pile of boiled pasta fusilli rotates slowly on table. on a black background.
1012800293,https://ak.picdn.net/shutterstock/videos/1012800293/preview/stock-footage-urban-architecture-view-of-a-glass-building-reflection-sky-timelapse-clouds-in-the-sky.mp4,PT00H00M12S,184401_184450,"Urban architecture, view of a glass building, reflection sky, timelapse, clouds in the sky.
"
1043126626,https://ak.picdn.net/shutterstock/videos/1043126626/preview/stock-footage-airplane-take-off-croatia-in-christmas.mp4,PT00H00M08S,187251_187300,Airplane take off croatia in christmas
1051837771,https://ak.picdn.net/shutterstock/videos/1051837771/preview/stock-footage-sailing-boat-with-the-anchor-water-view.mp4,PT00H00M11S,127501_127550,Sailing boat with the anchor water view
1020229549,https://ak.picdn.net/shutterstock/videos/1020229549/preview/stock-footage-dna-spiral-molecule-gathering-from-particles-and-rotating-animation-background-new-quality.mp4,PT00H00M20S,193351_193400,Dna spiral molecule gathering from particles and rotating animation background new quality beautiful natural health cool nice stock video footage
1031630399,https://ak.picdn.net/shutterstock/videos/1031630399/preview/stock-footage-snail-snail-eggs-under-the-microscope-the-movement-of-the-formed-embryos-ready-for-hatching.mp4,PT00H00M15S,090801_090850,"Snail. snail eggs under the microscope, the movement of the formed embryos ready for hatching"
1041895606,https://ak.picdn.net/shutterstock/videos/1041895606/preview/stock-footage-brown-tortie-blotched-tabby-and-white-maine-coon-domestic-cat-female-playing-against-white.mp4,PT00H00M05S,143951_144000,"Brown tortie blotched tabby and white maine coon domestic cat, female playing against white background, normandy in france, super slow motion 4k"
1010145245,https://ak.picdn.net/shutterstock/videos/1010145245/preview/stock-footage-aerial-view-of-gates-of-the-arctic-national-park-a-remote-landscape-without-roads-or-trails-a.mp4,PT00H00M23S,125701_125750,Aerial view of gates of the arctic national park a remote landscape without roads or trails a wilderness mountain region within the arctic circle alaska america
1009344638,https://ak.picdn.net/shutterstock/videos/1009344638/preview/stock-footage-animated-dark-grey-round-compress-tablet-pills-dancing-or-flying-against-transparent-background.mp4,PT00H00M14S,032001_032050,Animated dark grey round compress tablet pills dancing or flying against transparent background. alpha channel embedded with png file.
1030108892,https://ak.picdn.net/shutterstock/videos/1030108892/preview/stock-footage-mountain-range-in-the-southern-cyprus-cyprus.mp4,PT00H00M21S,135351_135400,Mountain range in the southern cyprus. cyprus 2019
1009913657,https://ak.picdn.net/shutterstock/videos/1009913657/preview/stock-footage-time-lapse-night-video-of-republic-square-in-yerevan-armenia.mp4,PT00H00M07S,044801_044850,"Time lapse night video of republic square  in yerevan, armenia "
1059768782,https://ak.picdn.net/shutterstock/videos/1059768782/preview/stock-footage-aged-male-teacher-is-giving-lectures-online-staying-home-using-laptop-with-internet-connection.mp4,PT00H00M13S,133801_133850,"Aged male teacher is giving lectures online, staying home, using laptop with internet connection and headphones"
1050502402,https://ak.picdn.net/shutterstock/videos/1050502402/preview/stock-footage-a-boy-in-overalls-lies-on-the-doorstep-of-the-house-and-his-mother-raises-him.mp4,PT00H00M08S,027451_027500,A boy in overalls lies on the doorstep of the house and his mother raises him
1016788585,https://ak.picdn.net/shutterstock/videos/1016788585/preview/stock-footage-aerial-uhd-k-flight-over-wild-staying-horses-herd-on-meadow-flying-over-wild-summer-mountains.mp4,PT00H00M54S,109401_109450,Aerial uhd 4k flight over wild staying horses herd on meadow. flying over wild summer mountains nature. beautiful animals at sunny rural green grass farm. freedom ecology concept.
1012236728,https://ak.picdn.net/shutterstock/videos/1012236728/preview/stock-footage-green-wheat-field-on-a-windy-day-close-up-countryside-landscape-agricultural-fields-meadows.mp4,PT00H00M13S,113951_114000,"Green wheat field on a windy day. close up. countryside landscape, agricultural fields, meadows, farmlands in spring. environment friendly farming, industrial agriculture concept"
1020949333,https://ak.picdn.net/shutterstock/videos/1020949333/preview/stock-footage-oriental-pied-hornbill-in-koh-tarutao-national-park-thailand-specie-anthracoceros-albirostris.mp4,PT00H00M09S,123051_123100,"Oriental pied hornbill in koh tarutao national park, thailand -  specie anthracoceros albirostris family of bucerotidae "
1031391224,https://ak.picdn.net/shutterstock/videos/1031391224/preview/stock-footage-aerial-view-of-drone-from-a-corn-plantation-in-brazil.mp4,PT00H00M15S,083551_083600,"Aerial view of drone from a corn plantation in brazil
"
4468199,https://ak.picdn.net/shutterstock/videos/4468199/preview/stock-footage-tbilisi-georgia-may-people-are-playing-football-soccer-in-front-of-an-armenian-church.mp4,PT00H00M08S,138651_138700,"Tbilisi, georgia - 3 may 2013: people are playing football (soccer) in front of an armenian church in the georgian city of tbilisi"
1042317037,https://ak.picdn.net/shutterstock/videos/1042317037/preview/stock-footage-sakura-s-tree-has-blossomed-sakura-flowers-filmed-to-close-up-and-behind-tree-are-blue-sky.mp4,PT00H00M15S,015351_015400,Sakura's tree has blossomed. sakura flowers filmed to close-up and behind tree are blue sky. 
1061855782,https://ak.picdn.net/shutterstock/videos/1061855782/preview/stock-footage-christmas-white-snowflakes-in-different-shapes-flying-on-the-black-background-snow-flakes-snow.mp4,PT00H00M15S,053951_054000,Christmas white snowflakes in different shapes flying on the black background. snow flakes snow background
1013450795,https://ak.picdn.net/shutterstock/videos/1013450795/preview/stock-footage-aerial-top-down-footage-of-waves-crashing-against-a-rocky-coastline-in-newfoundland-canada.mp4,PT00H00M14S,005951_006000,"Aerial top-down footage of waves crashing against a rocky coastline in newfoundland, canada."
21797998,https://ak.picdn.net/shutterstock/videos/21797998/preview/stock-footage-new-year-gifts-toys-and-christmas-tree-k-uhd-native-video.mp4,PT00H00M06S,038051_038100,"New year gifts, toys and christmas tree. 4k uhd native video"
27014977,https://ak.picdn.net/shutterstock/videos/27014977/preview/stock-footage-woman-with-hares-in-zoo.mp4,PT00H00M11S,199301_199350,Woman with hares in zoo
1031980622,https://ak.picdn.net/shutterstock/videos/1031980622/preview/stock-footage-medium-shot-of-year-old-asian-triplets-sitting-in-high-chairs-in-kitchen-wearing-bright-plastic.mp4,PT00H00M18S,101851_101900,"Medium shot of 1-year-old asian triplets sitting in high chairs in kitchen, wearing bright plastic bibs, and mother feeding them puree, one baby crying and refusing to eat, and another dropping food"
30826486,https://ak.picdn.net/shutterstock/videos/30826486/preview/stock-footage-panarama-the-sea-and-beatiful-beach.mp4,PT00H00M17S,098551_098600,Panarama the sea and beatiful beach
25125290,https://ak.picdn.net/shutterstock/videos/25125290/preview/stock-footage-sunrise-over-marshland-near-bad-toelz-bavaria-germany.mp4,PT00H00M20S,108051_108100,Sunrise over marshland near bad toelz bavaria germany
1022871676,https://ak.picdn.net/shutterstock/videos/1022871676/preview/stock-footage-abstract-fractal-forms-morph-and-oscillate-loop.mp4,PT00H00M10S,138701_138750,Abstract fractal forms morph and oscillate (loop)
1021400422,https://ak.picdn.net/shutterstock/videos/1021400422/preview/stock-footage-video-slow-motion-p-tapioca-plants.mp4,PT00H00M44S,062301_062350,Video slow motion 120p tapioca plants.
1027409780,https://ak.picdn.net/shutterstock/videos/1027409780/preview/stock-footage-little-beautiful-ducklings-on-green-screen.mp4,PT00H00M17S,073101_073150,Little beautiful ducklings on green screen
27690751,https://ak.picdn.net/shutterstock/videos/27690751/preview/stock-footage-patthalung-thailand-dec-the-negrito-of-thailand-they-are-a-saa-gai-tribe-who-live.mp4,PT00H00M09S,087001_087050,"Patthalung, thailand - dec 13 , 2015 : the negrito of thailand. they are a saa-gai tribe who live peacefully in the dense and impenetrable forest. in the south of thailand."
23988790,https://ak.picdn.net/shutterstock/videos/23988790/preview/stock-footage-valentine-day-heart-white-background.mp4,PT00H00M11S,010601_010650,Valentine day heart white background 3
1019819026,https://ak.picdn.net/shutterstock/videos/1019819026/preview/stock-footage-girl-laughing-and-holding-watermelon-and-giving-it-back-towards-camera.mp4,PT00H00M07S,019651_019700,Girl laughing and holding watermelon and giving it back towards camera
3739910,https://ak.picdn.net/shutterstock/videos/3739910/preview/stock-footage-baby-skudde-sheep-jumping-around-mother.mp4,PT00H00M18S,050301_050350,Baby skudde sheep jumping around mother
18459277,https://ak.picdn.net/shutterstock/videos/18459277/preview/stock-footage-july-xining-china-people-are-making-jumah-praying-on-the-street-outside-dongguan-great.mp4,PT00H00M12S,067751_067800,"July.1,2016-xining,china: people are making jumah praying on the street outside dongguan great mosque.  "
21907339,https://ak.picdn.net/shutterstock/videos/21907339/preview/stock-footage-lizard-quickly-moves-on-the-stone-moss-grown-in-mountainous-terrain.mp4,PT00H00M07S,192851_192900,"Lizard quickly moves on the stone, moss-grown in mountainous terrain."
1011711308,https://ak.picdn.net/shutterstock/videos/1011711308/preview/stock-footage-kyiv-ukraine-february-show-in-the-fashion-week-catwalk-fashion-show-model-models.mp4,PT00H00M18S,084051_084100,"Kyiv, ukraine – february 6, 2017. show in the fashion week. catwalk. fashion show. model. models. the model goes along the catwalk. presentation of clothes on the catwalk during a fashion show. model."
1009436825,https://ak.picdn.net/shutterstock/videos/1009436825/preview/stock-footage-animation-of-flying-into-digital-technologic-tunnel-from-glowing-and-flickering-particles-and.mp4,PT00H00M20S,117751_117800,Animation of flying into digital technologic tunnel from glowing and flickering particles and circuit surface. animation of seamless loop.
1059905264,https://ak.picdn.net/shutterstock/videos/1059905264/preview/stock-footage-beautiful-aerial-view-with-white-winter-forest-road.mp4,PT00H00M30S,050051_050100,Beautiful aerial view with white winter forest road  
1040880788,https://ak.picdn.net/shutterstock/videos/1040880788/preview/stock-footage-cotton-field-in-israel-blowing-in-the-wind-ready-for-harvesting-dolly-in.mp4,PT00H00M17S,055101_055150,"Cotton field in israel,blowing in the wind, ready for harvesting. dolly in "
24241724,https://ak.picdn.net/shutterstock/videos/24241724/preview/stock-footage-spring-in-berlin-germany.mp4,PT00H00M19S,110501_110550,"Spring in berlin, germany"
1022183851,https://ak.picdn.net/shutterstock/videos/1022183851/preview/stock-footage-steam-smoke-from-pipes-at-a-thermal-power-station-aerial-copter-shooting-k.mp4,PT00H00M19S,149851_149900,"Steam, smoke from pipes at a thermal power station. aerial. copter shooting 4k"
35069089,https://ak.picdn.net/shutterstock/videos/35069089/preview/stock-footage-green-cactus-with-sharp-thorns-close-up-shot.mp4,PT00H00M06S,194151_194200,Green cactus with sharp thorns close up shot
1028197538,https://ak.picdn.net/shutterstock/videos/1028197538/preview/stock-footage-geiranger-and-lovatnet-lake-from-above-norway.mp4,PT00H00M11S,198551_198600,"Geiranger and lovatnet lake from above, norway"
1017123916,https://ak.picdn.net/shutterstock/videos/1017123916/preview/stock-footage-english-breakfast-with-lettuce-tasty-dish-on-wooden-background.mp4,PT00H00M06S,124501_124550,English breakfast with lettuce. tasty dish on wooden background.
1016459557,https://ak.picdn.net/shutterstock/videos/1016459557/preview/stock-footage-fresh-raw-pork-meat-on-the-table-woman-beats-meat-close-up.mp4,PT00H00M12S,038151_038200,"Fresh raw pork meat on the table, woman beats meat. close up"
